{
  "$schema": "https://json-schema.org/draft/2020-12/schema",
  "title": "Gateway observer config v1",
  "type": "object",
  "additionalProperties": false,
  "required": [
    "schema_version",
    "enabled",
    "config_version",
    "gateway_instance_id",
    "observer_cluster",
    "routes",
    "chunk_bytes",
    "callback_max_bytes",
    "callback_max_chunks",
    "request_body_max_bytes",
    "rewrite_timeout_ms",
    "rewrite_reservation_bytes",
    "root_rewrite_budget_bytes",
    "root_max_rewrites",
    "response_body_max_bytes",
    "stream_inflight_bytes",
    "stream_inflight_messages",
    "root_max_streams",
    "root_inflight_bytes",
    "root_inflight_messages",
    "ack_timeout_ms",
    "end_ack_timeout_ms",
    "observation_max_ms",
    "tick_ms",
    "metadata_max_bytes",
    "ack_max_bytes"
  ],
  "properties": {
    "schema_version": {
      "const": 1
    },
    "enabled": {
      "type": "boolean"
    },
    "config_version": {
      "type": "string",
      "minLength": 1,
      "maxLength": 128
    },
    "gateway_instance_id": {
      "type": "string",
      "minLength": 1,
      "maxLength": 128
    },
    "observer_cluster": {
      "type": "string",
      "minLength": 1,
      "maxLength": 256
    },
    "routes": {
      "type": "array",
      "maxItems": 128,
      "items": {
        "type": "object",
        "additionalProperties": false,
        "required": [
          "route_name",
          "methods",
          "paths",
          "adapter_id"
        ],
        "properties": {
          "route_name": {
            "description": "精确路由名；单独的 * 表示忽略路由名，仍按 method/path 和顶层 Host 白名单筛选，包括路由名不可读的请求。事件单独记录实际 Envoy 路由名，不可读时为 unknown。规则按配置顺序选择，先命中的路由规则决定启用与路径匹配。",
            "type": "string",
            "minLength": 1,
            "maxLength": 128
          },
          "enabled": {
            "type": "boolean",
            "default": false
          },
          "methods": {
            "const": [
              "POST"
            ]
          },
          "paths": {
            "type": "array",
            "minItems": 1,
            "maxItems": 16,
            "uniqueItems": true,
            "items": {
              "type": "string",
              "minLength": 1,
              "maxLength": 1024,
              "pattern": "^/[^?#*\\[\\]{}()|^$\\\\]*$"
            }
          },
          "adapter_id": {
            "const": "chat_completions_v1"
          }
        }
      }
    },
    "chunk_bytes": {
      "type": "integer",
      "minimum": 1,
      "maximum": 16384
    },
    "callback_max_bytes": {
      "type": "integer",
      "minimum": 1,
      "maximum": 4294967295
    },
    "callback_max_chunks": {
      "type": "integer",
      "minimum": 1,
      "maximum": 4294967295
    },
    "request_body_max_bytes": {
      "type": "integer",
      "minimum": 1,
      "maximum": 262144
    },
    "rewrite_timeout_ms": {
      "type": "integer",
      "minimum": 1,
      "maximum": 2000
    },
    "rewrite_reservation_bytes": {
      "type": "integer",
      "minimum": 1,
      "maximum": 4294967295
    },
    "root_rewrite_budget_bytes": {
      "type": "integer",
      "minimum": 1,
      "maximum": 9223372036854775807
    },
    "root_max_rewrites": {
      "type": "integer",
      "minimum": 1,
      "maximum": 4294967295
    },
    "response_body_max_bytes": {
      "type": "integer",
      "minimum": 1,
      "maximum": 8388608
    },
    "stream_inflight_bytes": {
      "type": "integer",
      "minimum": 1,
      "maximum": 4294967295
    },
    "stream_inflight_messages": {
      "type": "integer",
      "minimum": 1,
      "maximum": 4294967295
    },
    "root_max_streams": {
      "type": "integer",
      "minimum": 1,
      "maximum": 4294967295
    },
    "root_inflight_bytes": {
      "type": "integer",
      "minimum": 1,
      "maximum": 9223372036854775807
    },
    "root_inflight_messages": {
      "type": "integer",
      "minimum": 1,
      "maximum": 4294967295
    },
    "ack_timeout_ms": {
      "type": "integer",
      "minimum": 1,
      "maximum": 4294967295
    },
    "end_ack_timeout_ms": {
      "type": "integer",
      "minimum": 1,
      "maximum": 4294967295
    },
    "observation_max_ms": {
      "type": "integer",
      "minimum": 1,
      "maximum": 600000
    },
    "tick_ms": {
      "type": "integer",
      "minimum": 1,
      "maximum": 4294967295
    },
    "metadata_max_bytes": {
      "type": "integer",
      "minimum": 6144,
      "maximum": 6144,
      "default": 6144
    },
    "ack_max_bytes": {
      "type": "integer",
      "minimum": 1,
      "maximum": 1024
    },
    "accepted_request_hosts": {
      "description": "采集 Host 白名单：精确 DNS 域名、*.example.com（任意层级子域名，不含根域名）或 *（所有合法 DNS Host）。缺省或空数组不采集；规则转小写并去末尾根点，拒绝端口、IP、其他通配符和规范化后的重复项。",
      "type": "array",
      "default": [],
      "maxItems": 1024,
      "uniqueItems": true,
      "items": {
        "type": "string",
        "minLength": 1,
        "maxLength": 256,
        "pattern": "(?:\\*|(?:\\*\\.)?[A-Za-z0-9](?:[A-Za-z0-9.-]*[A-Za-z0-9])?\\.?)"
      }
    }
  }
}
